{
  "version": "test-fixture",
  "updated": "2025-01-01",
  "sources": [],
  "botanical_families": {
    "poaceae": {"name_ru": "Злаковые", "name_latin": "Poaceae"},
    "fabaceae": {"name_ru": "Бобовые", "name_latin": "Fabaceae"},
    "asteraceae": {"name_ru": "Астровые", "name_latin": "Asteraceae"}
  },
  "crops": [
    {
      "crop_id": 1,
      "crop_name": "Пшеница",
      "botanical_family": "poaceae",
      "rotation_rules": {
        "return_interval_years": {"min": 2, "recommended": 3},
        "good_predecessors": [
          {"crop_id": 19, "rating": "excellent", "reason": "Бобовые насыщают почву"}
        ],
        "bad_predecessors": [
          {"crop_id": "family:poaceae", "reason": "Общие болезни"}
        ],
        "incompatible_families": ["poaceae"]
      }
    },
    {
      "crop_id": 19,
      "crop_name": "Горох",
      "botanical_family": "fabaceae",
      "rotation_rules": {
        "return_interval_years": {"min": 3, "recommended": 4},
        "bad_predecessors": [
          {"crop_id": 19, "reason": "Нужен перерыв"}
        ],
        "incompatible_families": []
      }
    },
    {
      "crop_id": 37,
      "crop_name": "Подсолнечник",
      "botanical_family": "asteraceae",
      "rotation_rules": {
        "return_interval_years": {"min": 4, "recommended": 6},
        "bad_predecessors": [
          {"crop_id": 37, "reason": "Белая гниль"}
        ],
        "good_predecessors": [
          {"crop_id": "family:fabaceae", "rating": "excellent", "reason": "Азот"}
        ],
        "incompatible_families": ["asteraceae"]
      }
    }
  ]
}
